"Id","grant_title"
"061205","Characterization of glycoproteins from the flagellar pocket and endocytic pathway and the role of actin in polarized traffic in African trypanosomes."
"084253","Improving quality of paediatric outpatient malaria case-management using mobile phone text-messaging in Kenya."
"090367","Next-Generation Disease Association Analyses: Low pass Sequencing and High Density SNP genotyping for type 2 diabetes ."
"077883","Regulation of N type calcium channel expression, trafficking and modulation"
"057704","Molecular and cellular pathways underlying development and resolution of airway remodelling."
"061183","Multidisciplinary investigations into the biological role of TF11-1 family transcription factors in developmental phenotypes including behaviour and cognition."
"081475","The molecular mechanisms of activation of G-protein gated inwardly rectifying K+ channels"
"075813","African swine fever virus: Development of vaccines and epidemiological investigations."
"078067","Optimizing the translation of MODS into policy and practice to maximize utility and impact"
"073597","Clinical and immunological evaluation in East Africa of new malaria vaccines encoding the circumsporozoite protein."
"086338","Immunology, infection and translational medicine."
"085349","The Wellcome Trust Centre for Molecular Parasitology"
"063122","Effects of intestinal helminth infections in early childhood on immune response, inflammation, anaemia and malnutrition. No cost extension until 1.2.06."
"042065","Differentiation and function of mechanosensory epithelial cells from the mammalian inner ear."
"088908","Engineering Solutions for an Ageing Population with Musculoskeletal & Cardiovascular Disease. 50 more years after 50."
"076508","Coding and plasticity in the adult auditory system."
"072426","Bioinformatic and DNA immunisation strategies to generate neutralising antibodies specific to conserved haemostasis-disruptive toxins in African viper venom"
"074039","Identification of cellular factors involved in nuclear import of HIV-1 and DNA viruses."
"076951","Constructing contemporary global maps of Plasmodium falciparum and P.vivax endemicity."
"077383","Learning from the human genome how protective immunity against malaria works."
"057559","The Y chromosome as a marker for the history and structure of human populations."
"093705","Dissecting compulsivity."
"076827","Improving the delivery of evidence based care for severely ill children at district level in Kenya."
"077166","Major overseas programme Thailand. Thailand funds."
"088719","Functional maturation of ribbon synapses in mammalian cochlear inner hair cells."
"082744","Emerging arboviruses: the effect of vector and host biology and genetic diversity on the emergence and maintenance of the flaviviruses."
"082345","Studies of human adipose tissue function - a way to understand complications of obesity, lipodystrophy and type 2 diabetes."
"061584","Infection dynamics of respiratory syncytial virus. Molecular and immuno-epidemiological studies in rural Kenya."
"073135","Evaluation of the determinants of human scrub typhus infection."
"075491","Identification and functional analysis of susceptibility genes in multifactorial disease."
"055558","Antigenic variation and transmission of African trypanosomes."
"077186","Mouse Cancer Genetics and Genomics"
"057586","The enzymology of genetic recombination and DNA repair in Schizosaccharomyces pombe."
"063560","Organophosphate pesticide poisoning in Sri Lanka - management, complications and pharmacogenetics. Supplementary funds."
"079895","Cambridge Institute for Medical Research (CIMR)."
"098362","The neurobiology of motivation in health and disease."
"064874","The functions of the AgToll protein from Anopheles gambiae during malaria parasite infection."
"077044","Analysis of protein and RNA sequence."
"077092","KEMRI-Wellcome Kenya Programme - core support renewal 2005-2010"
"087797","A quantitative (Bayesian) assessment of veterinary surgeons clinical beliefs in order to improve preventive healthcare for dairy cattle."
"077016","Genetic studies of the aetiology of human metabolic disease: morbid obesity, obesity, severe insulin resistance and type 2 diabetes."
"090532","Understanding the genetic basis of common human diseases: core funding for the Wellcome Trust Centre for Human Genetics."
"091593","Core support for the Wellcome Trust Centre for Neuroimaging"
"079791","The genetic basis of podoconiosis - a model for gene environment interactions."
"079766","Sensori-motor Mechanisms of Extrapolation in Human Vision."
"096072","How does the pathogen Candida albicans sense heat and activate the thermal adaptation mechanisms that promote infection?."
"077108","Genome-wide identification of novel extracellular protein:protein interactions with functional annotation in the model vertebrate, the zebrafish."
"081849","Acentrosomal spindle formation in female meiosis."
"098024","Understanding the role of CpG islands in gene regulatory element function and transcription."
"090569","Costs and effects of a multifaceted intervention to improve the quality of care of children in district hospitals in Kenya"
"092573","In vivo imaging of Trypanosoma cruzi infections as a tool for assessing drug efficacy against chronic Chagas disease."
"071614","Research and training to reduce morbidity and mortality from malaria in Papua (Indonesia) and PA."
"081858","Elucidating the molecular mechanisms of intracellular mRNA transport and anchoring."
"082335","Investigation of the functions of variant histone H2A.Z acetylation ."
"069267","Genetic analysis of vaccine-induced immunity to Hepatitus B virus infection."
"073300","Epidemiology of age-related eye disease in India:INDEYE"
"086736","Cellular and Molecular Physiology"
"079080","Malaria burden and control at national, regional and global scales."
"079828","Karonga Prevention Study: HIV and infectious disease control in a rural African population, part I HIV."
"097806","Structural Biology of Protein Folding on the Ribosome."
"079862","The placenta, oxidative stress and the maternal inflammatory response in pre-eclampsia."
"067232","Case-control study of levels and patterns of alcohol consumption and socio-economic factors in relation to mortality among working-age men in the Udmurt Republic, Russia"
"074732","The genetics of drug resistance in African trypanosomes."
"088130","Functional architectures in the brain."
"083485","Characterisation of Orc1/Cdc6 and DNA replication initiation in Trypanosoma brucei."
"077489","The molecular and cell biology of the Epstein-Barr virus (EBV) EBNA3 family of latency-associated proteins."
"074617","Molecular and cellular approaches to ocular angiogenesis."
"089059","Maintaining functional integrity of gastric epithelium:identification of novel transcriptional mechanisms."
"085622","The biosynthesis of glycoproteins in Trypanosoma brucei: basic and translational research."
"086598","Coated vesicle adaptors."
"091074","T-cell regulation of CNS autoimmune disease."
"066695","Protective type 1 helper T cell responses induced by Neospora caninum infection are detrimental to the maintenance of pregnancy in cattle."
"082623","Modelling the impact of HSV-2 interventions on HIV transmission in sub-Saharan Africa."
"083209","The cellular and molecular basis of disease."
"076908","An open label randomised comparison of injectable artesunate and quinine in patients with severe falciparum malaria in Africa."
"084538","Developing research capacity and leadership in East Africa from the KEMRI- Wellcome Trust Research Programme, Kenya"
"084679","Malawi-Liverpool-Wellcome Trust Clinical Research Programme."
"087582","Systematic analysis of essential parasite genes linked to invasion of the host cell in Toxoplasma gondii."
"095021","How centromeres are specified: the interplay between heterochromatin, CENP-A chromatin, and kinetochore assembly."
"053335","The nature and causes of language impairments in children."
"063410","Strategies for the management of multi-drug resistant tuberculosis in Kampala, Uganda."
"076945","Mechanisms and consequences of host-mediated macrophage apoptosis in pneumococcal pneumonia. min bid02000405"
"081569","An integrated multi-disciplinary approach to unravel complex and essential cell wall biosynthetic pathways involved in arabinogalactan and lipoarabinomannan assembly in Mycobacterium tuberculosis."
"074128","The regulation of excitatory and inhibitory junctional transmission."
"091296","Extrachromosomal elements of Chlamydia: Development of an efficient transformation system for Chlamydia trachomatis."
"088517","Complement, SLE and modulation of the adaptive immune response."
"064409","Molecular mechanism by which the Map, EspF, Tir and Intimin effector proteins of enteropathogenic E.coli trigger disease-related responses."
"069909","The histone acetylation machinery in Trypanosoma brucei."
"070994","Latherin: a natural horse sweat surfactant protein for biomedical and environmental applications."
"065530","The action of the Epstein-Barr virus encoded RNAs in vivo"
"089273","The cellular basis and pathogenic consequences of mitogen-activated protein kinase phosphatase-2 regulation of innate and adaptive immunity ."
"089543","The Vasopressin System-Asynchronous burst firing as a signal encoding mechanism."
"082584","School-based intervention to improve the mental health of low-income, secondary school students in Santiago, Chile."
"082496","Role of cyclin-dependent kinase-5 in vascularization after ischaemic stroke."
"069388","Approaches towards understanding the molecular pathogenis of motor neurone degeneration and identification of targets for therapeutic intervention."
"087968","Adenosine release in the preoptic forebrain areas that control sleep assessing the role of astrocytes."
"088359","Role of the exosome complex in RNA quality control ."
"070797","Rural-urban migration: effects and obesity and diabetes in Indians"
"091845","HTLV-1 clonality: the role of the genomic integration site."
"081835","An effectiveness study of 7-valent Pneumococcal Conjugate Vaccine administered through EPI in the Kilifi Demographic Surveillance Survey Area."
"072182","The development and lifespan of memory CD4+ T cells following malaria infection in humans."
"068580","The role of the occipito-temporal cortex in reading."
"063713","Cognitive function and structure of language processing in children with SLI: A neuropsycholinguistic investigation."
"063009","The Vertical Transmission study: a cohort study to assess the impact of exclusive breastfeeding on postnatal transmission of HIV."
"074833","The effect on cardiovascular risk factors of migration from rural to urban areas in Lima, Peru."
"086596","Genetics and genomics of central obesity ."
"060446","Comparison of Plasmodium falciparum and Plasmodium malariae population structure."
"066890","Dendritic cell function and immune responsiveness in malaria infections."
"081052","Cluster randomised controlled trial of the effect of community mobilisation onneonatal survival in Mumbai slums."
"057730","A new cell signal required for patterning and morphogenesis downstream of EGFR-Ras."
"074538","Regulating cellular immune responses to malaria."
"080340","The Role of Interleukin-6 in Generation and Maintenance of Influenza-Specific CD4+ T Cell Memory."
"066335","C1q-dependent innate immunity to Streptococcus pneumoniae."
"068026","Investigation of the cytokine profile in invasive pneumococcal disease and host determinants of disease susceptibility and severity in Malawian children."
"083563","Discovery and annotation of regulatory elements in metazoan genomes."
"080867","Molecular characterisation of drug resistance in the human malarias."
"061858","JDRF/WT Diabetes and Inflammation Laboratory."
"081829","Defining vulnerable populations using spatial models to support the equitable delivery of insecticide treated nets (ITN) in Kenya."
"084368","Studies of Dengue pathogenesis and vaccines in Vietnam for improved case management and primary prevention ."
"092766","Assessing the acceptability and competence of Community Health Workers (CHWs) as providers of malaria treatment in Kenya."
"092741","Integrated studies of the targets, regulation and consequences of human immunity to malaria."
"076934","Human genetic polymorphism and natural resistance to malaria with an emphasis on disorders of the red blood cell."
"085042","Epidemiology of human non-typhoidal salmonella in Nairobi."
"089472","Bacterial epidemiology, evolution and bioinformatics for public health."
"093488","Merging theory and field studies for infectious disease dynamics."
"074695","Studies of natural selection on malaria parasite merozoites in relation to invasion and immunity."
"080086","The immunodominant O-antigen and Salmonella enterica pathogenesis: examining the phage origin, distribution, expression and role of a family of O-antigen modification gene clusters."
"095127","Mapping the risks of Plasmodium falciparum infections in areas of low transmission intensity ."
"088885","Applied statistical genetics."
"077224","Methyl-CpG binding proteins in physiology and disease."
"083228","Mechanisms of cardiovascular pleiotropy and buffering in Cited2 deficiency."
"084957","The control of MHC class I by viral and cellular E3 ligases."
"078990","The pathophysiology of rickettsial disease in Southeast Asia."
"079082","Cellular immune responses in children with Plasmodium falciparum infection."
"086166","Measuring changes in paediatric malaria hospitalization in Kenya, Uganda and Zambia 2000-2010."
"083620","The challenge of chronicity:Host-Parasite conflict in gastrointestinal nematode infection."
"085316","Model-based Imaging of the Subcortical Salience System ."
"085406","Creating a geo-referenced resource of inherited haemoglobin disorder gene frequencies."
"096919","Mitochondrial DNA - expression, disease and treatment."
"065061","Linking RNA interference, silent chromatin formation and kinetochore assembly."
"090219","Determining routes of B. pseudomallei infection and development of evidence-based guidelines for the prevention of melioidosis."
"076558","Studies on the biochemical modifications regulating initiation, propagation and stabilisation of intracellular signals that modify T cell behaviour."
"085956","Post-transcriptional regulation of gene expression in trypanosomes."
"073405","Development and use of sandfly EST microarrays to study gene expression in response to Leishmania infection."
"083573","Analysis of quantitative trait networks in disease models."
"090354","Wellcome Trust Clinical PhD Programme in International Health at the LSHTM: 'Immune recovery uveitis in HIV-infected adults in India: incidence and risk factors'."
"083184","11beta hydroxysteroid dehydrogenase type 1 and atherosclerosis risk."
"083735","A study of the epidemiology of lower respiratory tract infection and pneumococcal carriage in refugee infants living on the Thai-Burmese border."
"054523","Cell polarity and cell fate determination in C. elegans."
"078363","The genetics of myopia and refractive error: analysis of highly significant linkage loci."
"088293","The regulation of life cycle differentiation in African trypanosomes."
"085284","Neurodegeneration and aging: roles for DNA single-strand break repair."
"089673","Wellcome Trust Clinical PhD Programme at the University of Liverpool."
"092281","Targetting NFAT as a therapeutic strategy in COPD."
"089698","A systematic investigation into the pathogenesis and course of Parkinson's syndrome."
"076036","Identification of the molecular mechanisms underlying activation of chemokine receptor CCR3 by the Eotaxin family of chemokines."
"099667","Structural Biology: From Molecules to Cells."
"066780","Cardiovascular Functional Genomics: translating experimental work to human disease."
"082274","The role of the Human Immunodeficiency Virus Type 1 (HIV-1) Vpu protein in overcoming a novel antiviral restriction of virus release."
"093052","Control of gene expression by the MAP kinase and SUMO pathways."
"089589","The neural and neurochemical basis of compulsivity in humans and other animals."
"086783","Dynamic Cell Biology"
"085064","The demography, population genetics and genome evolution of viral pathogens in an innate immunity model."
"065810","Prevention of infection associated premature delivery in a rural population in Malawi."
"075219","Cost-Effectiveness Evaluation of a Nutrition and Exercise Programme for Older People in Chile."
"075237","Molecular Interactions of CFTR, AMPK and NDPK in Cystic Fibrosis."
"081203","The control of epithelial cell phenotype by extracellular matrix."
"066688","Clinical epidemiology of HSV-2 and the impact of interventions against sexually transmitted infections to reduce HIV incidence in high risk women from gold mining communities in Tanzania."
"083942","Structural studies of cell-matrix interactions."
"076943","Clinical evaluation of innovative tuberculosis vaccination strategies."
"089275","Thailand Major Overseas Programme Core Grant Renewal 2010 to 2015."
"091745","Statistical genetics."
"075871","Fundamentals of Veterinary Science Summer School."
"096686","The Structural Basis of Biological Mechanism"
"081878","Genetics of ageing: the genetic and environmental determinants of ageing in women."
"083270","An investigation of genes in key beta-cell pathways following the type 2 diabetes WTCCC genome wide association study."
"081589","Cognitive impairment in cerebral small vessel disease : a prospective imaging study."
"056750","Modelling functional brain architecture."
"082813","Structure, function and evolution of the trypanosome nuclear envelope ."
"076527","The role of PRH, the nuclear matrix and chromatine remodelling in the regulation of transcription."
"079375","Genetic exchange in trypanosomes."
"079838","Characterisation and validation of drug targets in the Kinetoplastida."
"092779","Circulating B lymphocytes as biomarkers for latent tuberculosis infection status in Uganda"
"076956","The function of antibody in a complex viral infection. min num bid02010405"
"087436","Development of statistical methodology for detection and characterisation of genetic factors in complex disease."
"076352","Innate and acquired cellular immunity an HIV-seropositive mothers and their infants."
"085937","The genetic basis and pathophysiology of dyskeratosis congenita, aplastic anaemia, myelodysplasia and related disorders."
"085090","Molecular characterisation of NOD1 and NOD2 mediated ligand recognition and signal transduction."
"088291","Molecular magnetic resonance imaging with microparticles of iron oxide."
"085972","Autotransported proteins of Burkholderia pseudomallei."
"065478","Infection and Immunity."
"089550","How and when are bacterial flagellins glycosylated?"
"076467","ALSPAC: consolidation of a two generation cell line backed resource, for the study of the environment and genetic determinants of health and development from before birth to late puberty."
"082384","Africa Centre for Health and Population Studies: Core Support"
"075820","An integrated approach for the development of sustainable methods to control tropical theileriosis."
"065978","Macrophage-derived chitinases as novel mediators of eosinophil recruitment in pararsitic infection and allergic disease."
"078326","The determination of the basic HLA Class-1 associated protection in HTLV-1 infection."
"078170","Function and regulation of the ubiquitin ligase TRAC-1 in T cells."
"073381","Transdifferentiation of pancreatic cells to periportal and perivenous hepatocytes."
"084804","The impact of oxidative and endoplasmic reticulum stress on placental protein synthesis and maternal and fetal wellbeing."
"084151","Molecular and Cellular Basis of Synaptic Vulnerability During Neurodegeneration."
"068706","Phylogeographical studies of the Asian schistosomes and their hosts."
"079200","Transcription repression of nuclear receptor action in ovulation and metabolic regulation."
"082028","Immuno-epidemiology of schistosomiasis: from the mouse model to natural human infection."
"079810","Molecular biology of bunyavirus host cell interactions."
"064693","The impact of helminths on the response to immunisation and on susceptibility to infectious diseases in childhood in Uganda."
"083931","Schistosomiasis, hookworm and atopy in Uganda: IgE function, regulation and immunity."
"077229","Functional genomic analysis of Anopheles gambiae innate immunity and interaction with the malaria parasite."
"085440","Control of intestinal schistosomiasis and molecular epidemiology of Schistosoma mansoni in Ugandan infants and preschool children."
"083625","Structural and biophysical analysis of novel lipid binding proteins from parasitic helminths."
"079588","Staphylococcus aureus invasion of host cells: the role of multiple fibronectin-binding sites, integrin-clustering and caveolae in invasion."
"090767","Investigating the molecular mechanisms of homologous recombination at DNA double-strand breaks and perturbed replication forks."
"078779","Intracellular signalling in response to stress in Candida albicans."
"078400","A Genetic study of hemocyte motility and chemotaxis in Drosophila embryos."
"094252","The structural dynamics of modular polyketide synthases."
"081279","The genetic basis of variation in the susceptibility of Drosophila to viral infection."
"076456","In depth analysis of the interactions between the Multifactor Complex (MFC) composed of elFs 1, 3, 5 and elF2-GTP-Met-tRNAiMet and the 40S ribosomal subunit and their physiological importance for the regulation of eukaryotic"
"080566","Mechanisms of target cell entry and applications of protein toxinx."
"086105","The ergonomics of electronic patient records: an interdisciplinary development of methodologies for understanding and exploiting free text to enhance the utility of primary care electronic patient records."
"079660","Investigating genetic leanness: what goes ""right"" in obesity-resistance."
"079281","The structural biology of cell signalling and regulation: multiprotein systems and the achievement of high signal-to-noise ratios."
"073049","Integrin-binding by a herpes simplex virus surface protein."
"085391","Early induction of pro-adhesive state by P.falciparum cytoadherence."
"082315","Exploring the cognitive functions of the medial temporal lobe."
"088677","Investigation of metabolism and substrate utilization of Mycobacterium tuberculosis."
"075294","Cellular responses to uncapped telomeres in budding yeast."
"077711","Identification of the kinases and phosphatases that regulate phosphorylation and activity of the Na-K-2Cl cotransporter in response to environmental change"
"069162","Insect-parasite interactions and the control of vector-borne disease."
"085256","Structural features necessary for VSG function."
"081673","The epidemiology, spatial ecology and transmission dynamics of co-infection with Plasmodium falciparum and hookworm in East Africa"
"077014","Understanding genome dynamism: medical consequences and evolutionary implications of duplicated sequences in mammalian genomes."
"084169","RNA localisation in the Xenopus oocyte."
"077461","Molecular basis of receptor-adhesin interactions of human respiratory pathogens."
"077503","Modification, trafficking and secretion of Leishmania infective stage proteins."
"078223","The role of promastigote secretory gel in potentiating cutaneous leishmaniasis transmission by sand fly bite."
"065374","The London Pain Consortium."
"091561","Community resource centres to improve the health of women and children in Mumbai slums: a cluster randomized controlled trial of a complex intervention."
"085275","Identification of antigen-specific T-cells and protein signatures as diagnostic biomarkers for sarcoidosis."
"077748","Molecular mechanisms of shortstop function essential for neuronal growth."
"078631","Developmental Biology"
"085309","Correlation between the cellular functions of the myosin family of molecular motors and their biochemical & structural properties."
"083429","Role of TLR2 in the sensing of oxidants and ensuing inflammation: Implications for Therapeutic Intervention."
"095066","Defining the population at risk and burden of disease of Plasmodium vivax malaria."
"091924","An evidenced based platform for the wider utility of serological analysis in malaria control and elimination."
"077198","Vertebate genome annotation. The creation of the reference genesets for human, mouse and zebrafish."
"074125","Malarial disease in children."
"085492","Investigation of the lupus susceptibility gene, TNFSF4 (OX40L)."
"090318","Delivery, uptake and acceptability of HPV vaccination in Tanzanian girls."
"073616","Structural studies on GTPases and EDG family G protein-coupled receptors."
"086091","Higher resolution cardiovascular epidemiology: unique insights from linking the national cardiac event register with primary care records and highly phenotyped cohorts."
"081613","The epidemiology and transmission dynamics of avian influenza."
"085411","Kuteerera muviri? Engaging men in TB control interventions."
"079059","Wolbachia as a tool for the control of mosquito-borne disease."
"081880","Signal transduction by GSK-3beta in craniofacial development."
"073915","The role of non-histon proteins in chromosome structure and function during mitosis and apoptosis."
"063150","Comprehensive studies of a new improved oral rehydration solution for diarrhoeal disease: Physiological and molecular studies, clinical trials, and acceptability and efficacy studies in a rural south Indian community."
"085448","Defining the features of minimal imprinted loci generated by retrotransposition."
"076111","Characterisation of TAT and antennapedia mediated protein delivery in vivo and its utility for the targeting of apoptosis during acute lung injury."
"088619","An investigation into a viral cause of canine chronic hepatitis."
