"Id","grant_title"
"065975","T lymphocyte signal transduction: analysis of the biochemistry and biology of Rho family GTPases and the serine kinase Protein Kinase D in T cells."
"066681","Evaluating strategies to delay the emergence of resistance to antimalarial drugs."
"087622","Population genomics of the Neisseria: evolution of commensalism and virulence."
"082464","Ethnic differences in risks and outcomes of the cardiometabolic syndrome: Southall And Brent REvisited: SABRE."
"088862","Impact of early infectious and microbial exposures on the development of immunity and allergic inflammatory disease in children living in a tropical region of Ecuador."
"084071","Genetics of the MHC and LRC."
"084113","Human and Veterinary Vaccinology."
"078256","The PE and PPE proteins of Mycobacterium tuberculosis and Mycobacterium bovis: exploring their potential as variable antigens."
"080958","The London PAIN Consortium."
"090281","Mediators of regulation and immunity in helminth infections."
"089875","Molecular and Cellular Basis of Infection."
"089276","Viet Nam Major Overseas Programme Core Grant Renewal 2010-2015."
"098045","Measuring the control and elmination of neglected tropical diseases in Africa."
"086370","The role of nucleoside diphosphate kinase B (NDPK B) in regulating CFTR function in health and disease"
"080913","Physiological Sciences"
"084535","Measuring the impact of naturally acquired immunity on the expression of Plasmodium falciparum variant surface antigens."
"079666","A combinatorial approach using steroidgenic factor-1 (SF-1, NR5A1) to elucidate novel mechanisms in adrenal and reproductive biology."
"084229","Three-dimensional proteomics: Mapping the geometry of large protein assemblies using cross-linking, mass spectrometry, and bioinformatics."
"063668","Revisiting the lacunar hypothesis: are lacunar strokes really different?"
"074414","The neuroanatomy of speech perception - clinical and cognitive interactions."
"095121","Wolbachia as a tool for the control of mosquito-borne disease."
"090669","Signal integration by annexin 2 during retinal phagocytosis."
"077705","Drug discovery for tropical diseases."
"076656","Role of SC1/PRDM4, a PRDM family transcription factor in the development and maintenance of the nociceptive phenotype of primary sensory neurons"
"084072","Single nucleotide polymorphism analysis of population structure and virulence in E. histolytica."
"080304","Structural biology of type I restriction-modification enzymes."
"081828","An integrated epidemiological study of zoonotic pathogens in linked human and animal populations in rural Kenya."
"080348","Genetic manipulation of Chlamydia trachomatis."
"075438","Kinetic principles of translational control in Saccharomyces cerevisiae."
"071669","Reducing deaths from pesticide poisoning -establishing a regional toxicology research centre"
"083515","Characterization of pyrethroid resistance in field populations of Anopheles funestus, malaria vector in Africa."
"084743","Extended genome wide association study in coeliac disease."
"082809","Hexose-6-phosphate dehydrogenase and Glucose-6-phosphate: novel regulators of corticosteroid hormone metabolism and adrenal function."
"092677","The detection and management of ivermectin resistance in human onchocerciasis."
"084241","The role of stem and progenitor cell populations in skeletal muscle homeostasis, repair and regeneration."
"084226","Investigation into Plasmodium falciparum rosetting mechanisms and development of rosette-disrupting interventions to treat or prevent severe malaria."
"071381","Mechanisms of the delayed effects of RSV infection."
"088148","Investigating the molecular basis of cryptococcal hypervirulence underlying the Vancouver Outbreak."
"072064","Defining the spectrum of sickle cell disease in East Africa: a clinico-epidemiological study."
"077266","An integrated functional genomic approach to understanding gene regulation during neurogenesis."
"059437","Immunological correlates of protection from HIV infection and disease progression in a world-wide context."
"084678","Signalling by RhoGTPases in the regulation of epithelial cell-cell adhesion and differentiation."
"079518","Promoting and directing nerve growth and wound healing in vivo."
"073377","Molecular mechanisms underlying the agonist and antagonist effects of Beta-adrenoceptor ligands at the human Beta1 and Beta2 adrenoceptor."
"081855","Antigen I/II protein-host receptor interactions in Streptococcus colonization and pathogenesis."
"083905","MAPK phosphatase-1 (MKP-1) in corticosteroid (CS) responsiveness of oxidative stress and allergic inflammation: towards a model of CS resistance."
"080741","Studies in the pathogenesis and control of blinding trachoma."
"083679","A randomised cluster controlled trial of community level interventions to address social and structural determinants of physical activity, diet and mental well being."
"082648","The encoding of optic flow and self-motion in human cortical areas MST and VIP."
"081705","Plague epidemiology and risk in the heterogeneous rural landscapes of Madagascar ."
"073228","Confocal microscopy for time-lapse, FRET and calcium imaging analyses of cellular processes."
"077426","The role of mTOR/PDK1 activated protein kinases in the development of skeletal muscle hypertrophy."
"067454","The role of dendritic cells in RSV infection and RSV induced reactive airway disease."
"092539","The role of caspase-2 in retinal ganglion cell apoptosis after optic nerve transection."
"075853","Characterisation of Lv-2 a cellular restriction to HIV replication."
"092532","Defining protein-protein interaction networks in cytochrome c assembly."
"062511","A multi-collaborative microbial pathogen microarray facility."
"073131","Role of complement receptor type 1 (CR1, CD35) in immune adherence, complement regulation and malarial pathogenesis - a structural approach."
"068362","Ethnicity and cardiovascular risk factors: a study in children."
"088785","Wellcome Trust Centre for Cell-Matrix Research core award renewal."
"083251","Molecular and cellular basis of infection."
"090940","Characterisation of host virus interactions."
"091947","Surveillance for influenza in the context of pandemic H1N1 in an African population with a high burden of HIV, Malaria and Malnutrition."
"088316","Quadruple intervention against tuberculosis."
"084323","Establishment of a Centre for Clinical Infectious Diseases Research at the University of Cape Town (Wellcome-UCT-CCIDR)."
"071979","An experimental and phylogenetic approach to understanding RNA virus evolution"
"079866","Imaging neuroscience at the Functional Neuroimaging Laboratory (FIL)"
"083707","Nutritional challenges, abdominal adiposity and type 2 diabetes in Indians."
"094277","Biogenesis of the red blood cell membrane in health and disease."
"081345","The role of von Willebrand Factor (VWF) in malaria pathogenesis."
"076806","Evaluating community-based delivery of mosquito abatement for malaria control by the municipal councils of Dar es Salaam."
"078925","Monitoring trends in malaria transmission using serological markers of malaria exposure."
"079027","The Greater Black Krait (Bungarus niger) in Bangladesh: ecology, epidemiology and management of envenoming bites."
"061173","Redox and antioxidant pathways of the malaria parasite Plasmodium falciparum- characterisation and validation as potential drug targets."
"081168","Convergence of insulin signalling and GLUT4 trafficking at a regulated membrane fusion step."
"090441","FluPro - a novel flu antiviral."
"066745","Functional genomics of pluripotent stem cells and their progeny."
"066357","11Beta-Hydroxysteriod dehydrogenases and human disease."
"076678","The role of Fgfr2 signalling during organogenesis, epithelial development and tissue repair."
"080796","NCS-1 interactions with AP-2 and TGF beta receptor type I and effects on endocytosis."
"068634","The role of TNF-alpha in interleukin-13 mediated resistance to Trichuris muris."
"086352","Novel Circadian Oscillators in the Mediobasal Hypothalamus."
"076612","Differentiation of adult prostatic stem cells in vivo and in vitro."
"073735","Fronto-striatal control of action in health and disease."
"085744","Kinesin motorproteins in Trypanosoma brucei: Functional characterisation and drug target validation."
"074322","Genetic epidemiology of tick-borne disease systems."
"081512","Nitric oxide signalling in the CNS."
"082596","Structure, specificity and mechanism of biosynthetic enzymes in trypanosomatids and inhibitor discovery of essential microbial functions."
"080723","The effect of maternal health, fetal size and early childhood growth on cardiovascular (CVS) development in Nigerian children."
"065699","White matter connections brain maturation and neuropsychology development in young adults born very preterm."
"087590","Molecular mechanisms of O-GlcNAc signalling."
"072773","The role of dermatopontin and keratan sulphate proteoglycans in regulating corneal matrix organisation."
"082930","Development of the software ClonalFrame into a generally applicable tool for analyzing bacterial sequence data and association mapping."
"084588","Pulsatile signalling via gonadotrophin-releasing hormone receptors."
"083313","The anti-inflammatory and cell protecting activities of enteropathogenic E.coli (EPEC)."
"076990","Investigation and characterisation of a novel cell-cycle regulatory protein upregulated by Epstein-Barr virus EBNA 3C."
"064014","Molecular analysis of the regulation of transcription by Epstein-Barr virus."
"089102","Conjugate vaccine that protects against typhoid fever caused by the Salmonella enterica serovars Typhi and Paratyphi A."
"082119","The role of VAP in ER-plasma membrane bridges."
"090300","Mechanisms of Muskelin/RanBP9/CTLH complex."
"084582","Genetic engineering of refractory mosquito vectors for the control of malaria transmission."
"076954","General purpose and clade-specific virulence in Candida albicans."
"086550","Proteases in egress of the malaria parasite from its host red blood cell."
"085308","Epidemiology of zoonoses amongst livestock and their keepers in East Africa."
"082601","Host-parasite interactions elucidated by McMC based Bayesian inference."
"056727","Multiphoton confocal imaging, fluorescence correlation and time-resolved spectroscopy to study membrane rafts, protein folding and olfactory coding."
"093711","Molecular and Cellular Biology"
"083498","Validation of the APOBEC3G-Vif interaction as a drug target."
"069924","pH regulation in the intracellular malaria parasite."
"083524","Centre for Gene Regulation and Expression."
"088536","Does increased household income among the poor contribute to reversal of the social gradient of obesity in Egypt?"
"084336","Oxidative stress signalling and cellular responses in decidualizing human endometrium."
"081917","Whole-genome transcriptomic profiling: A resource for the discovery of expression QTLs associated with common disease."
"096388","Diabetes and Inflammation Laboratory."
"066676","Effects of cortical injuries on the neurophysiological, molecular and behavioural functions."
"075934","Cellular and genetic analysis of dendritic morphogenesis and synaptic patterning"
"090812","Understanding the multiple roles of the key eukaryotic translation initiation factor 3 (eIF3) and its associated eIFs in both general and gene-specific translational control on the molecular level."
"090315","Poxvirus immune evasion strategies."
"077012","Cancer Genome Project."
"059141","Childhood tuberculosis: identification of the molecular immunological basis of susceptibility and resistence to mycobacterial infection."
"094752","Functional analysis of the Plasmodium falciparum cGMP-dependent protein kinase."
"078538","Molecular epidemiological, population genetic and clinical studies on Plasmodium knowlesi and other potentially zoonotic malaria parasites in Malaysian Borneo."
"084507","Telomeres and subtelomeres in yeast."
"082234","Understanding phenotypic plasticity in the reproductive strategies of malaria parasites ."
"093160","The mechanism of Hsmar1 transposition and its epigenetic interactions with the host."
"091163","Upgrade of the Wellcome Trust Protein NMR Facility at Kent."
"059131","Urban community randomization trial of sexually transmitted disease."
"076734","Hsp90 as a molecular target in lymphatic filarial worms."
"064722","Severe anaemia in Malawian children: A detailed investigation into the aetiology, pathogenesis and long term outcome."
"077273","Investigations of tuberculosis-specific memory/effector T cell responses in HIV-infected children receiving highly-active anti-retroviral therapy (HAART)."
"086113","Scottish Health Informatics Programme (SHIP) ."
"075336","Genetic analysis of latrophilin function in the mouse."
"085255","Understanding the role of cyclo-oxygenase isoforms in cardiovascular health and disease."
"082260","In vitro differentiation of human ES cells can produce tractable and physiologically credible surrogates for monocyte-derived macrophages for use in HIV studies."
"078390","Regulation of smooth muscle cell (SMC) maturation by transforming growth factor (TGF)-b1 in development and disease."
"082498","Genetic, neurological and cognitive determinants of success and failure in learning a first language."
"081385","Molecular mechanisms governing X chromosome inactivation; a model for understanding epigenetic regulation of the genome in differentiation and development."
"092311","Unraveling the dynamics of rapidly evolving infectious diseases in humans with Approximate Bayesian Computations."
"089235","The ecology and evolution of avian influenza viruses in the Caucasus region."
"081601","Purinergic signalling in Dictyostelium discoideum."
"081276","Mechanisms of action of eosinophils and their granule proteins."
"092107","Tail-anchored protein biogenesis: coordinating pathway selection."
"081624","Molecular characterisation and intervention of norovirus replication."
"089061","Integrated genome wide profiling of common traits: genetics of cardiovascular and neuropsychiatric diseases."
"074679","The impact of maternal and infant geohelminth infections on atopy and vaccine immunity in infants living in rural tropical region of Ecuador."
"083547","Ion channels: structure to function via biomolecular simulations."
"074246","Cell movement, interaction and fate during early mammalian embryogenesis."
"072033","Interactions between sub-threshold conductances and their functional relevance at auditory synapses."
"084067","Investigating neural communication with multivariate autoregressive models."
"071657","Pathways to improved sustainable morbidity control and prevention of schistosomiasis in the People's republic of China."
"079351","Regulation of transcription elongation by Spt4/5 and NusA."
"072070","Understanding tuberculosis in Cape Town, South Africa"
"085496","Shape, Form and Function in Kinetoplastid Parasites: The Subpellicular Microtubule Cytoskeleton ."
"085777","MMPs and therapeutic response in tuberculosis."
"063215","Plasmodium falciparum erythrocyte membrane protein 1 and var gene expression, parasite sequestration and anti-adhesion antibody responses."
"080971","Uncovering the functions of the Foxp2 gene in the mammalian central nervous system."
"077078","Wellcome Trust Major Overseas Programme - Hospital for Tropical Disease Vietnam."
"076939","Cellular and molecular basis of the spatial organisation of collagen fibrils."
"085133","Density-Dependent Host Choice by Onchocerciasis Vectors."
"074333","Psychophysiological mechanisms underlying psychological and physical morbidity."
"084668","Does a mother's dietary intake during pregnancy influence brain development and therefore cognitive ability?."
"059879","Investigation of alternative splicing mechanisms."
"082130","Antigenic variation in malaria: A genome-wide approach."
"077192","Richard Durbin faculty research in computational genomics: sequence analysis mmethodology and TreeFam, a new gene classification resource."
"085836","Development of the adaptive T-cell immune response to nontyphoidal salmonella with age in Malawian children."
"064766","The immune response to HTLV-1: lymphocyte function and genetic control."
"061231","Pulmonary defence and susceptibility to infection with Streptocccus pneumoniae in HIV-infected Malawian adults."
"077995","BMP2/4 signalling in T cell development."
"085295","Structure and function of IP3 receptors."
"071248","Neural bases of spatial memory and navigation."
"089979","Life course inequalities in asthma: estimating its burden and understanding its aetiology."
"074361","The farnesoid X receptor (FXR) as a novel target in cardiovascular disease."
"082931","Transgenic C. elegans as a method for studying drug resistance genes of parasitic nematodes."
"069962","A four year PhD programme in Bioinformatics."
"073980","Structure and function of the mammalian cell nucleus."
"090944","Combined genetic and biochemical approaches to uncover and characterize redundant factors involved in late stages of recombinational repair."
"078317","Schistosome life-cycle expression profiling using a full-transcriptome DNA mocroarray."
"091182","Selfish mutations in the testis: impact on evolution and disease."
"082450","Growth Factor Signal Interpretation."
"066270","Approaches to understand the molecular basis of Huntingdon's disease and develop therapeutic interventions."
"083811","Conditional Translational Repression: a core regulatory mechanism of gene expression during development of the malaria parasite - study and applications."
"086785","Genomic Medicine & Statistics"
"071672","Building evidence based research and practice in South East Asia: Impact on pregnancy and childbirth care and outcomes."
"057097","The identification of susceptibility genes for multiple sclerosis."
"081278","Alternate messenger RNA processing and mRNA surveillance of key pancreatic transcription factors in monogenic diabetes."
"063558","Epidemiology of mycobacterial and HIV infections in Northern Malawi."
"091746","Genomics of quantitative variation."
"085540","Social Epidemiology of Psychoses in East Anglia [SEPEA] study: disentangling poverty, migration and urbanicity."
"084674","Wellcome South Asia Centre."
"068461","The impact of a water development on parental investment in rural Ethiopia."
"070268","Microaerophilic respiratory metabolism in Neisseria meningitidis."
"063516","Natural transmission blocking immunity to malaria: specificity and duration of efficacy."
"077929","Understanding the significance of the AIPL1:NUB1 interaction for photoreceptor homeostasis"
"098504","Exploiting the potential offered by the increasing computerisation of health records for population based research."
"072822","Molecular analysis of adherence of staphylococci to the epidermis. Mechanism of binding to keratin 10 (and fibrinogen) by clumping factor B of Staphylococcus aureus."
"073107","Signalling by ITAM and integrin receptors in platelets."
"081548","Histone modifications and developmental gene expression in Dictyostelium."
"083248","Molecular and cellular basis of infection."
"067595","Structural and functional characterisation of intrinsically unstructured proteins."
"078285","Drug discovery for malaria based on novel drug targets, with the aim to find a one dose cure for Plasmodium faliciparum and a curative modality for Plasmodium vivax."
"075731","Human glomerular endothelium: barrier properties and interactions with podocytes as contributors to the glomerular filtration barrier. Previously minuted Conditional as PHY00181004"
"095582","A lifecourse approach for understanding levels, trends, determinants and consequences of physical activity, and to inform interventions and policy for global action."
"079792","Monocarboxylate transporters and their ancillary proteins: studies on the molecular basis of their interaction and distinct properties."
"085354","The role of SUMOylation in synaptic kainate receptor plasticity."
"088304","Effect of inflammation and insulin on glucose homeostasis in the airway epithelium."
"089455","Wellcome Trust PhD Programme for Clinicians at the University of Oxford: 'Investigation of the role of Plasmodium falciparum EBA and RH family antigens in immune evasion and as multi-antigen vaccine candidates.'"
"091663","Function and specificity of T cells in persistent virus infection."
"083018","Diabetes-induced bone marrow microangiopathy: a novel target to combat ischaemic complications. ."
"080388","Effects of in-utero exposure to environmental chemicals via maternal pasture ingestion on fetal development."
"083464","The control of vertebrate neural identity by the integration of dorsoventral signals and anterioposterior intrinsic determinants."
"095605","Mechanisms of client protein activation and regulation by the Hsp90 molecular chaperone system."
"064947","Determinants of cardiovascular diseases in Eastern Europe: a multi-centre cohort study."
"017948","Modulation of extracellular neurotransmitter concentration"
"072346","The role of zebrafish exostosin-2 during gastrulation and cartilage differentiation."
"077459","Understanding the Bdellovibrio predation machinery: secreted hydrolytic enzymes, contributions of the core genome and testing for prey responses."
"083539","Mechanoregalation of patterning genes during development of the embryonic skeleton: growth and differentiation in the absence of muscle contractions."
"083481","Wellcome Trust Centre for Drug Discovery."
"090679","Improving dengue control in Colombia by optimizing the selection of insecticides."
"086423","Impact of urbanisation on malaria vectors population dynamic in two major cities of Cameroon ."
"084273","A comparative functional investigation of two developmentally regulated Schistosoma mansoni venom allergen like molecules (SmVALs)."
"081772","The evolution and impact of HIV-1 resistance following the public health rollout of antiretroviral therapy in Africa."
"068050","Genomic characteristics of viruses producing chronic tick-borne encephalitis in experimental animals."
"079491","Stem cell approaches in infantile Batten disease"
"082782","Monitoring the influence of T lymphocyte plasma membrane condensation on the formation and protein composition of signalling complexes at the sites of TCR activation."
"077185","How are cognitive subprocesses integrated in the brain? FMRI, EEG and TMS studies of working memory."
"093587","Functional and population genomics of the Anopheles innate immune system and its interactions with malaria parasites."
"085242","Reducing childhood mortality in the tropics. Development of a combined antimalarial-antibacterial rectal formulation for community use."
"069714","Behavioural and sub-cellular dissection of non-rod, non-cone ocular photoreceptors in mice and man."
"074961","The effects of schistosomiasis and malaria co-infection on hepatosplenomegaly amongst Kenyan school children."
"077368","Initiation of the repair of collapsed replication forks in Bacillus subtilis."
"066784","Molecular determinants of virus re-activation, latency and pathogenesis."
"084730","Genome-wide association studies in partial epilepsies."
"083629","Determination of the molecular basis of the cellular functions of Pdcd4, a novel type of tumour suppressor protein with key roles in the regulation of transcription and translation."
"086168","A novel role of the KSHV ORF57 protein in translation enhancement."
"069590","Neuroanatomical and functional analysis of fruitless-expressing neurons involved in male sexual behaviour in Drosophila."
"084483","Requirement of lipoteichoic acid for growth of Staphylococcus aureus and in vivo characterization of the essential lipoteichoic acid synthase LtaS."
"081755","Analysis of structural and functional aspects of compartmentation of adenine nucleotides in heart muscle cells."
"071663","EphB receptors and spinal processing of pain."
"087518","Regulation of autophagy in Drosophila."
"090433","The systems and synthetic biology of cell-cell variability- a combined statistical and control engineering approach"
"068589","Biomphalaria glabrata: gene discovery, expression, profiling and interval mapping to elucidate mechanisms of resistance to Schistosoma mansoni."
"079920","Memory B/T cell responses in individuals with varying levels of acquired immunity."
"085767","Investigating functions of the chromosomal protein Ledgf."
"080368","Analysis of the molecular mechanisms which activate alternative pre-mRNA splicing pathways in germ cells and repress these splicing events in somatic cells."
"071613","Neonatal immunisation with pneumococcal conjugate vaccine in Papua Guinea."
"093553","The molecular basis of female reproductive biology in the malaria mosquito Anopheles gambiae."
"084659","Investigating the role and regulation of a putative interphase histone phosphatase in Drosophila."
"097737","The Local Bases of Global Health: Primary Health Care in South Asia and beyond, 1945-2010."
"084955","Investigating the early post-entry steps of the retrovirus life cycle."
"076964","Understanding pathogen diversity and evolution and their consequences for human and animal health and disease through sequencing and comparative analysis."
"058992","The epidemiology, geography and therapy of clinical malaria in Africa."
"080988","Characterising immune recognition of microbial lipid antigens during human Mycobacterium tuberculosis infection."
"086735","Clostridium difficile and the host immune response ."
"097015","Biomedical Vacation Scholarship."
"071626","Investigation of allele specific antibodies to Plasmodium falciparum erythrocyte binding proteins based on patterns of molecular evolution."
"081667","Clinical proteomic and genomic characterisation of the immune reconstitution inflammatory syndrome in HIV-associated tuberculosis"
"094664","Wolbachia as a defence against RNA viruses in insects."
