"Id","grant_title"
"083226","Immunological investigation of pericardial tuberculosis"
"086868","Cone photoreceptor rescue in inherited retinal degenerations."
"089401","Prevalence of common mental disorders and the association with resilience among internally displaced people (IDP) in Puttalam district of Sri Lanka."
"088877","Centre of Excellence in Personalised Healthcare."
"083597","The rapid and selective detection of Mycobacterium tuberculosis by field deployable thermochemolysis-gas chromatograph-mass spectrometry."
"088312","Biophysical mechanisms of goal-based decision-making."
"088266","Role of MxiC in activation of the Shigella T3SS and hierarchical effector secretion."
"091730","Mesenchymal Stromal Cells as Therapeutic Vectors for Metastatic Cancer."
"071161","Molecular genetics and cell-matrix pathology of monogenetics cartilage diseases."
"082178","Making better use of computerised clinical data for epidemiological research."
"083140","Structural and functional neuroimaging studies in adolescents with disruptive behaviour disorders."
"064772","The relationship between protein folding and protein degradation in the endoplasmic reticulum."
"095806","Risk factors for violent crime and repeat offending in severe mental illness."
"082791","Orienting Attention based on Memory: Neural Mechanisms of Control and Modulation."
"079287","Identification of CD8 epitopes in cattle pathogens by systematic synergistic analysis of peptide specificity and 3D structures of cattle MHC class I."
"082273","Evolutionary Ecology of Microbial Virulence."
"088844","A Centre for Medical Engineering Solutions in the Management of Osteoarthritis."
"097427","Computational Infection Biology"
"088876","Genetic Analysis of the Roles of Pax6 in Maintaining Corneal Homeostasis ."
"088641","King's College London Medical Engineering Centre."
"081219","The role of nicotinamide nucleotide hydrogenase in beta-cell metabolism, detoxification of reactive oxygen species and insulin secretion."
"080952","Clinical, Cellular, and Molecular Characterisation of Novel Syndromes of Abnormal Growth and Insulin Action."
"075800","Development of effective live vaccines for prevention of anaplasmosis and babesiosis."
"087640","Centre for the Development and Evaluation of Complex Interventions for Public Health Improvement (DECIPHer)."
"089757","Investigating Friedreich ataxia molecular disease mechanisms and therapy using mouse neural stem cell technology."
"086867","The patho-physiology of the ALX receptor in inflammation."
"091201","Characterization of stem cells and the dynamics of neurogenesis in the adult hypothalamus."
"070696","Biological, iatrogenic and socio-political factors in the recent up-surge of tick-borne encephalitis and Lyme disease in the Baltic States."
"076192","Hospitalworks: a site-specific performance for 3-6 year olds and their accompanying adults."
"083506","Effects of prenatal alcohol consumption and alcohol metabolising genes on child growth and neurodevelopment in the ALSPAC study ."
"077593","High efficiency, site-directed engineering of the mosquito genome for the control of vector borne disease."
"084277","Activity-dependent control of bulk endocytosis by the dynamin - syndapin interaction."
"081713","Delineation of discrete brain circuitry regulating obesity and type 2 diabetes in mice."
"091882","Mechanism of physiological thalamocortical rhythms."
"086974","Implications of early life and contemporary exposures on body composition, human capital, mental health, and precursors of complex chronic diseases in three Brazilian cohorts (1982, 1993 and 2004)."
"091409","Sensory reinforced cortico-striatal plasticity."
"076381","The survival of bacteria under restorations: a paradigm shift in operative dentistry."
"076775","Dissecting the roles of novel accessory factors required for autotransporter secretion."
"084762","Genome-wide association study of extreme obesity in young adults."
"061100","Analysis of cellular immune responses against persistent virus infections."
"085057","In vivo analysis of mechanisms underlying muscle sarcomere assembly."
"081809","Study of ion channel function in the sinoatrial node in wild-type and genetically modified mice."
"074641","Incident tuberculosis among HIV-infected individuals receiving antiretroviral treatment in South Africa."
"093136","Functional analysis of the fat mass and obesity-associated gene FTO."
"087497","Cellular mechanisms of interaction of neuronal information provided by mossy fibres with the CA3 network."
"073617","The role of iron in the growth of Leishmania donovani and in interaction with host macrophages."
"081703","Functional changes in vacine IE62 and other essential viral proteins contribute to attenuation of vOka varicella-zoster vaccine for replication in epithelial tissue."
"070001","Structural studies of the Haemophilius influenzae Hia Autotransported Adhesin."
"092749","A Biological Repository for Schistosomiasis Research."
"093292","Change detection in human auditory cortex."
"087261","Wellcome Trust Clinical PhD Programme in International Health (LSHTM):- First line ART failure management in resource-limited settings: using observational data to inform decisions to switch from first- to second-line ART."
"076608","Characterisation of innate immunity to viral infection."
"069426","The role of interferon-gamma in human immunity to Burkholderia pseudomallei."
"082098","Glycomic characterization of avian influenza binding sites in the respiratory tract of humans and susceptible animals."
"086558","The role and modulation of Dectin-1 function in innate and adaptive immunity."
"098326","Regulatory dynamics of vertebrate neural tube development."
"077544","University of Sheffield Centre for BioImaging"
"079864","Generation and characterisation of human monoclonal antibodies to highly pathogenic H5N1 viruses."
"085949","The Proteomics Identifications Database (PRIDE)."
"082640","Analysing PLA2 signalling as a potential therapeutic target for branched shortchain fatty acids using the model system Dictyostelium."
"069142","Mathematical modelling of neuronal differentiation dynamics during development."
"081862","Carbohydrate export in bacteria."
"088789","Systematic Bioinformatic Discovery of 'Hidden' Virus Genes."
"074940","Eugenics and Genetics - the role of the concept of 'eugenics' in contemporary debates about the regulation of genetic and reproductive technologies."
"089357","The interplay of Wnt and Notch signalling in the segmentation clock mechanism."
"076442","The role of the SmrC virulence regulator and prolipoprotein signal peptidase during Streptococcus pneumoniae infection."
"095507","Cytoadherence-mediated pathology in cerebral malaria."
"074242","Function and control of the endocytic system of the African Trypanosome."
"098374","Chromosome segregation and cytokinesis in bacteria: mechanisms and regulation."
"080921","The host protective role of IL-4R alpha responsive T cells and macrophages against schistosomiasis."
"084068","Cyclic adenosine diphosphoribose (cADPR) and adenosine diphosphoribose (ADPR) analogues in human T-lymphocyte chemical biology."
"075833","Bovine Tuberculosis in the Developing World."
"087262","Wellcome Trust Clinical PhD Programme in International Health (LSHTM):- Tuberculosis control in a South African community with high HIV prevalence: the role of antiretroviral therapy and intensified case-finding."
"074296","Risk patterns and processes for affective psychopathology during adolescence."
"077988","Live imaging and genetic investigation of the inflammatory response at sites of would repair in mouse and zebrafish models."
"097411","Controlling the intracellular fate of cytosolic pathogens."
"088140","The role of RGC-32 in Epstein-Barr virus mediated cell-cycle deregulation."
"072789","An investigation of genetic determinants of susceptibility and disease behaviour in early onset inflammatory bowel disease."
"084621","Evaluation of viral vector-mediated inactivation of regions of the medial prefrontal cortex: impact on cognition and executive function."
"077384","Novel antigen design and delivery for mucosal protection against HIV-1 infection."
"078173","Factors Defining T Cell Mediated Immunopathology in Psoriasis."
"084686","Objective measurements of physical activity in primary school children in UK Millineum Cohort"
"093080","Oxidative stress-induced inflammatory gene expression and ageing in COPD: role of sirtuin-1 and histone methylation"
"066133","The epidemiology of dementia and Alzheimer's disease in admixed populations in Brazil and Cuba."
"067121","Function of GSK-3 in response to inhibitory axon guidance molecules."
"075452","Infection and Immunity."
"065687","The role of cocaine and amphetamine regulated transcripts as an endogenous regulator of energy intake and energy expenditure."
"097057","Biomedical Vacation Scholarships"
"081082","Pregnancy, antiretroviral therapy and HIV disease progression in women."
"077877","Regulation of alternative splicing by PTB and cofactors."
"079699","Analysing the interactions of arthropod-borne viruses with their arthropod host."
"084316","Polyadenylation and mechanisms of nuclear RNA quality control."
"088588","Establishment and maintenance of a global tick cell line collection"
"088431","Investigation of the role of telomere attrition in Type 2 diabetes and its complications."
"065377","ACDIS/HIV additional funds for 2005-2007."
"092447","Identifying low frequency and rare genetic variation involved in type 2 diabetes using next generation sequencing data."
"075419","Cryo-electron tomography of HIV."
"085047","Apoptotic cells, B cells and immune regulation of autoimmune disease."
"091842","The historical intersection of psychiatry and 'sexual deviation' between 1949-1992: exploring the role of nurses and the experience of former patients."
"057146","Reducing the burden of non-insulin dependent diabetes mellitus: A randomised controlled trial of behavioural interventions to modify diet and physical activity in people with impaired glucose tolerance. (The EDP Study)."
"072406","Costa Rican health aging: longitudinal study of life course changes in survival, health, and living arrangements and their socioeconomic determinants."
"077009","Human evolution."
"069224","Candidate gene variation and the association between early growth and adult disease: studies in the 1966 Northern Finland Birth Cohort'."
"088858","The Candida albicans ORFeome project."
"086766","Bioinformatics and theoretical systems"
"073009","Roy Porter Memorial Studentship 2003-2006 ""Disease, Labour and Habitation: Understanding Health and Sanitation in the Tea Plantations of Darjeeling and Duars (Bengal, India), 1860-1980"""
